{
  "schema_version": 1,
  "updated_on": "2026-07-13",
  "notice": "This crosswalk identifies repository artifacts that require review after an authority signal. It does not determine legal effect, GAAP applicability, tax treatment, contract enforceability, or production readiness, and it never authorizes an automatic operational change.",
  "mappings": [
    {
      "id": "rent-delinquency-late-fees-and-interest",
      "name": "Rent delinquency, late fees, and tenant interest charges",
      "change_signals": [
        "new-authority",
        "source-content-changed",
        "effective-date-changed",
        "authority-status-changed",
        "applicability-fact-changed"
      ],
      "authority_references": [
        {
          "domain": "legal",
          "reference_type": "legal-registry-group",
          "reference": "core_article25",
          "authority_weight": "binding",
          "verification_rule": "Verify the current official Kansas source, effective date, applicability, and any later authority before changing a charge, grace-period, notice, or collection rule."
        },
        {
          "domain": "contract",
          "reference_type": "signed-agreement",
          "reference": "Executed tenant lease and amendments",
          "authority_weight": "contractual-evidence",
          "verification_rule": "Review the executed agreement for the affected tenant; a repository template or target policy does not establish enforceability."
        },
        {
          "domain": "accounting",
          "reference_type": "asc-topic-locator",
          "reference": "ASC 310",
          "authority_weight": "official-source-locator",
          "verification_rule": "Use authorized FASB access to verify scope, recognition, measurement, presentation, disclosure, and effective-date requirements for the actual transaction and reporting period."
        },
        {
          "domain": "accounting",
          "reference_type": "asc-topic-locator",
          "reference": "ASC 842",
          "authority_weight": "official-source-locator",
          "verification_rule": "Use authorized FASB access to determine lessor-accounting treatment for the actual lease facts; the topic locator is not a conclusion."
        }
      ],
      "affected_paths": [
        {
          "repository_path": "src/zoho-books/automations/late-fee-guard/Late_Fee_Guard.deluge",
          "artifact_type": "financial-automation",
          "required_action": "review-and-regression-test",
          "reason": "The function contains timing, percentage, eligibility, duplicate-prevention, and invoice-delivery behavior for late fees."
        },
        {
          "repository_path": "src/zoho-books/automations/monthly-interest-billing/Monthly_Interest_Billing.deluge",
          "artifact_type": "financial-automation",
          "required_action": "review-and-regression-test",
          "reason": "The function contains the tenant-interest rate, eligibility date, threshold, consolidation, and invoice-delivery behavior."
        },
        {
          "repository_path": "accounting/ACCOUNTING_POLICY_MATRIX.md",
          "artifact_type": "accounting-policy",
          "required_action": "document-no-change-conclusion",
          "reason": "The accounting treatment must remain separate from legal enforceability and must record any reviewed change or no-change conclusion."
        },
        {
          "repository_path": "legal/CURRENT_AUTHORITY_INDEX.md",
          "artifact_type": "legal-authority-library",
          "required_action": "regenerate-after-approval",
          "reason": "Only a qualified review can promote changed authority into the approved legal baseline."
        }
      ],
      "review_gate": {
        "required_roles": [
          "kansas-counsel",
          "cpa-or-qualified-accounting-reviewer",
          "finance-operator",
          "system-owner"
        ],
        "required_evidence": [
          "official-source-link",
          "effective-date-analysis",
          "applicability-analysis",
          "signed-agreement-check",
          "authorized-fasb-research",
          "regression-test-results",
          "production-configuration-check"
        ],
        "decision_record": "dual-review-memo-and-pull-request"
      },
      "automatic_change": "prohibited",
      "fail_closed_action": "block-affected-release-and-preserve-production"
    },
    {
      "id": "returned-payment-fees",
      "name": "Returned-payment fee assessment and invoicing",
      "change_signals": [
        "new-authority",
        "source-content-changed",
        "effective-date-changed",
        "authority-status-changed",
        "applicability-fact-changed"
      ],
      "authority_references": [
        {
          "domain": "legal",
          "reference_type": "legal-registry-group",
          "reference": "core_article25",
          "authority_weight": "binding",
          "verification_rule": "Verify current Kansas landlord-tenant law and any fee-specific authority before changing amount, timing, collection, or disclosure behavior."
        },
        {
          "domain": "legal",
          "reference_type": "legal-registry-group",
          "reference": "consumer_protection",
          "authority_weight": "binding",
          "verification_rule": "Review current Kansas consumer-protection authority for the actual payment and communication practice."
        },
        {
          "domain": "contract",
          "reference_type": "signed-agreement",
          "reference": "Executed tenant lease and payment terms",
          "authority_weight": "contractual-evidence",
          "verification_rule": "Confirm the affected tenant's executed terms; a configured fee amount is not proof that the charge is enforceable."
        },
        {
          "domain": "accounting",
          "reference_type": "asc-topic-locator",
          "reference": "ASC 310",
          "authority_weight": "official-source-locator",
          "verification_rule": "Use authorized FASB access for any material receivable conclusion and verify the relevant reporting period."
        }
      ],
      "affected_paths": [
        {
          "repository_path": "src/zoho-payments/webhooks/returned-payment-fee/src/index.js",
          "artifact_type": "payment-webhook",
          "required_action": "review-configuration-and-test",
          "reason": "The webhook decides whether a failed payment is final and may create a returned-payment fee invoice using a runtime amount."
        },
        {
          "repository_path": "src/zoho-payments/webhooks/returned-payment-fee/docs/environment-variables.md",
          "artifact_type": "operational-documentation",
          "required_action": "review-configuration-and-test",
          "reason": "Runtime fee, dry-run, signature, and invoice-delivery controls must stay aligned with reviewed policy."
        },
        {
          "repository_path": "accounting/ACCOUNTING_POLICY_MATRIX.md",
          "artifact_type": "accounting-policy",
          "required_action": "document-no-change-conclusion",
          "reason": "Any book-treatment effect must be documented separately from legal enforceability."
        },
        {
          "repository_path": "legal/CURRENT_AUTHORITY_INDEX.md",
          "artifact_type": "legal-authority-library",
          "required_action": "regenerate-after-approval",
          "reason": "Changed legal material cannot enter the approved baseline without human review."
        }
      ],
      "review_gate": {
        "required_roles": [
          "kansas-counsel",
          "cpa-or-qualified-accounting-reviewer",
          "finance-operator",
          "system-owner"
        ],
        "required_evidence": [
          "official-source-link",
          "effective-date-analysis",
          "applicability-analysis",
          "signed-agreement-check",
          "authorized-fasb-research",
          "regression-test-results",
          "production-configuration-check"
        ],
        "decision_record": "dual-review-memo-and-pull-request"
      },
      "automatic_change": "prohibited",
      "fail_closed_action": "block-affected-release-and-preserve-production"
    },
    {
      "id": "tenant-credits-payments-and-retainers",
      "name": "Tenant credits, unapplied payments, and retainers",
      "change_signals": [
        "source-content-changed",
        "effective-date-changed",
        "authority-status-changed",
        "applicability-fact-changed"
      ],
      "authority_references": [
        {
          "domain": "accounting",
          "reference_type": "asc-topic-locator",
          "reference": "ASC 305",
          "authority_weight": "official-source-locator",
          "verification_rule": "Use authorized FASB access to verify cash, restricted-cash, presentation, and disclosure requirements for the actual facts."
        },
        {
          "domain": "accounting",
          "reference_type": "asc-topic-locator",
          "reference": "ASC 310",
          "authority_weight": "official-source-locator",
          "verification_rule": "Use authorized FASB access to verify receivable recognition, measurement, and presentation for the reporting period."
        },
        {
          "domain": "accounting",
          "reference_type": "asc-topic-locator",
          "reference": "ASC 405",
          "authority_weight": "official-source-locator",
          "verification_rule": "Use authorized FASB access to evaluate liability recognition and extinguishment for the specific credit or retainer arrangement."
        },
        {
          "domain": "contract",
          "reference_type": "signed-agreement",
          "reference": "Executed tenant lease, payment plan, and credit documentation",
          "authority_weight": "contractual-evidence",
          "verification_rule": "Verify ownership, purpose, branch, restrictions, and authorized application of each credit from primary records."